<?xml version="1.0" encoding="UTF-8"?>
<Csomag_követés_CBOYZF xmlns:xs="http://www.w3.org/2001/XMLSchema-instance" xs:noNamespaceSchemaLocation="XMLSchemaCBOYZF.xsd">
    <raktár raktár_id="01">
    <ár>
        500
    </ár>
    <raktárba_érkezés>
        2023-10-10
    </raktárba_érkezés>
    <cím>
        <Isz>
            3881
        </Isz>
        <Város>
            Abaújszántó
        </Város>
        <Utca>
            Béke út
        </Utca>
        <házszám>
            1
        </házszám>
    </cím>
</raktár>
    <raktár raktár_id="02">
    <ár>
        1500
    </ár>
    <raktárba_érkezés>
        2023-10-11
    </raktárba_érkezés>
    <cím>
        <Isz>
            3881
        </Isz>
        <Város>
            Abaújszántó
        </Város>
        <Utca>
            Béke út
        </Utca>
        <házszám>
            2
        </házszám>
    </cím>
</raktár>
    <raktár raktár_id="03">
    <ár>
        1500
    </ár>
    <raktárba_érkezés>
        2023-10-12
    </raktárba_érkezés>
    <cím>
        <Isz>
            3860
        </Isz>
        <Város>
            Encs
        </Város>
        <Utca>
            Rákóczi út
        </Utca>
        <házszám>
            3
        </házszám>
    </cím>
</raktár>
    <Gyárihibás gyárihibás_id="11" raktár="01">
    <ár>
        100
    </ár>
    <márka>
        Samsung
    </márka>
    <név>
        Telefon
    </név>
</Gyárihibás>
    <Gyárihibás gyárihibás_id="12" raktár="02">
    <ár>
        200
    </ár>
    <márka>
        Apple
    </márka>
    <név>
        Airpods
    </név>
</Gyárihibás>
    <Gyárihibás gyárihibás_id="13" raktár="03">
    <ár>
        300
    </ár>
    <márka>
        Sony
    </márka>
    <név>
        Playstation
    </név>
</Gyárihibás>
    <B_R beszállító="21" darabszám="5" raktár="01">
</B_R>
    <B_R beszállító="22" darabszám="10" raktár="01">
</B_R>
    <B_R beszállító="23" darabszám="25" raktár="03">
</B_R>
    <beszállító beszállító_id="21" raktár="01">
    <várható_érkezés>
        2023-10-18
    </várható_érkezés>
    <ár>
        50000
    </ár>
    <csomagolás_típusa>
        Fólia
    </csomagolás_típusa>
</beszállító>
    <beszállító beszállító_id="22" raktár="02">
    <várható_érkezés>
        2023-10-16
    </várható_érkezés>
    <ár>
        40000
    </ár>
    <csomagolás_típusa>
        Boríték
    </csomagolás_típusa>
</beszállító>
    <beszállító beszállító_id="23" raktár="03">
    <várható_érkezés>
        2023-10-19
    </várható_érkezés>
    <ár>
        30000
    </ár>
    <csomagolás_típusa>
        Doboz
    </csomagolás_típusa>
</beszállító>
    <futár Rendelés_szám="31" raktár="01">
    <Helyzet>
        Úton
    </Helyzet>
    <várható_érkezés>
        2023-10-28
    </várható_érkezés>
    <ár>
        1500
    </ár>
</futár>
    <futár Rendelés_szám="32" raktár="02">
    <Helyzet>
        Áll
    </Helyzet>
    <várható_érkezés>
        2023-10-23
    </várható_érkezés>
    <ár>
        4000
    </ár>
</futár>
    <futár Rendelés_szám="33" raktár="03">
    <Helyzet>
        Felfüggesztve
    </Helyzet>
    <várható_érkezés>
        2023-10-29
    </várható_érkezés>
    <ár>
        2500
    </ár>
</futár>
    <ügyfél Csomagszám="41" futár="31">
    <VásárlásIdőpontja>
        2023-10-14
    </VásárlásIdőpontja>
    <VásároltTermék>
        Iphone 13 pro max
    </VásároltTermék>
    <Telefonszám>
        0620-714-9284
    </Telefonszám>
    <cím>
        <Isz>
            3881
        </Isz>
        <Város>
            Abaújszántó
        </Város>
        <Utca>
            Rákóczi út
        </Utca>
        <házszám>
            3
        </házszám>
    </cím>
</ügyfél>
    <ügyfél Csomagszám="42" futár="32">
    <VásárlásIdőpontja>
        2023-10-12
    </VásárlásIdőpontja>
    <VásároltTermék>
        Smasung galaxy A52
    </VásároltTermék>
    <Telefonszám>
        0620-394-2132
    </Telefonszám>
    <Telefonszám>
        0630-153-4576
    </Telefonszám>
    <cím>
        <Isz>
            3881
        </Isz>
        <Város>
            Abaújszántó
        </Város>
        <Utca>
            Béke út
        </Utca>
        <házszám>
            4
        </házszám>
    </cím>
</ügyfél>
    <ügyfél Csomagszám="43" futár="33">
    <VásárlásIdőpontja>
        2023-10-18
    </VásárlásIdőpontja>
    <VásároltTermék>
        Xbox Series X
    </VásároltTermék>
    <Telefonszám>
        0670-345-2376
    </Telefonszám>
    <cím>
        <Isz>
            3881
        </Isz>
        <Város>
            Abaújszántó
        </Város>
        <Utca>
            Kazincy út
        </Utca>
        <házszám>
            19
        </házszám>
    </cím>
</ügyfél>
</Csomag_követés_CBOYZF>